MisconceptionId,MisconceptionName,ConstructName,SubjectName,AnswerAText,AnswerBText,QuestionText,MisconceptionB
1201,Finds the arc length instead of the area of the sector ,Area of a Sector Calculation.,Geometry.,Approximately 52.36 square centimeters.,Approximately 10.47 centimeters.,What is the area of a sector of a circle with a radius of 10 cm and a central angle of 60 degrees?,Finds the arc length instead of the area of the sector.
1211,Believes number of squares in a bar gives frequency on a histogram,Understanding frequency representation in histograms.,Statistics,4 students scored within the range represented by that bar.,The test was out of 4 points.,"A histogram displays the number of students who scored various marks on a test. If a bar has 4 squares, what does this represent?",Believes number of squares in a bar gives frequency on a histogram
1217,Assumes the perpendicular height of a triangle bisects the base,"Area of triangles using base and height, understanding that the height does not necessarily bisect the base.",Geometry,24 square units,40 square units,"What is the area of a triangle with a base of 10 units and one side (not the base) of 8 units, assuming the perpendicular height bisects the base?",Assumes the perpendicular height of a triangle bisects the base
1218,Multiplies the numerators when adding fractions with a common denominator,Adding fractions with a common denominator,Fractions,\( \frac{5}{8} \),\( \frac{6}{8} \),What is the sum of the fractions \( \frac{3}{8} + \frac{2}{8} \)?,Multiplies the numerators when adding fractions with a common denominator
1219,Gives the value for the wrong variable when answering a simultaneous equation question,Solving Simultaneous Equations by Substitution or Elimination,Algebra,x = 2,y = 2,Two equations are given: 3x + 2y = 16 and 5x - y = 1. What is the value of x?,Solving for y instead of x.
1220,Does not include zero when counting over zero,Inclusive Counting Excluding Zero,Basic Counting Principles,10,9,"How many numbers are there from 1 to 10, excluding zero?",Does not include zero when counting over zero
1221,Converts a decimal to a fraction by writing 1 over the digits of the decimal,Converting Decimals to Fractions,Arithmetic,1/4,"0.25/1, 25/100",Convert the decimal 0.25 into a fraction.,Converts a decimal to a fraction by writing 1 over the digits of the decimal
1222,Forgets the denominator in probability,Calculating probabilities with mutually exclusive events,Probability,8/52 or 2/13,8,"In a deck of 52 playing cards, what is the probability of drawing an Ace or a King?",Forgets the denominator in probability
1223,Uses numerators to convert fractions to ratio despite different denominators,Understanding the importance of common denominators when comparing fractions,Fractions Comparison,"Explain that comparing fractions requires a common denominator or converting them to decimals, showing that 3/4 (0.75) is not twice as much as 2/3 (approximately 0.66).","Agree with the student's claim because 3 is indeed twice as much as 2, ignoring the denominators.","Two classes have test scores. Class A has an average score of 3/4 and Class B has an average score of 2/3. If a student claims that Class A performed twice as well as Class B because 3 is twice as much as 2, how would you correct this misunderstanding?",Uses numerators to convert fractions to ratio despite different denominators
1227,Forgets that a number without an indice is to the power of 1 ,Multiplication of powers with the same base,Exponents,125,"25, 50, 100",Simplify the expression \(5^2 \times 5\).,Forgets that a number without an indice is to the power of 1
1228,Believes sets are the same if the elements within them have a shared property,Properties of Sets and Elements,Set Theory,"{2, 4, 6, 8}","{1, 3, 5, 7, 9}","Which set represents the same elements as Set X = {2, 4, 6, 8} based on the property of being even numbers less than 10?",Believes sets are the same if the elements within them have a shared property.
1232,"Thinks the longest bar has the highest frequency on a pictogram, even if the symbols aren't evenly spaced",Understanding Frequency Representation in Unevenly Spaced Pictograms,Data Representation,Dealer B sold more cars.,Dealer A sold more cars because their bar is longer.,"In a pictogram showing the number of cars sold by different car dealers, Dealer A's bar reaches up to 5 big cars, while Dealer B's bar is shorter but represents 6 small cars packed more tightly. Which dealer sold more cars?","Thinks the longest bar has the highest frequency on a pictogram, even if the symbols aren't evenly spaced."
1236,Thinks the plan view is taken from an angle to include aspects of the side view and plan,Understanding Plan Views vs. Perspective Views in 3D Shapes,Geometry,"A square with equal sides, as seen from directly above.","A rectangle with longer sides, incorporating a perspective view.","A student is looking at a 3D shape and trying to draw its plan view. If the student thinks the plan view is taken from an angle to include aspects of the side view, which of the following drawings might they incorrectly produce for a cube?",Thinks the plan view is taken from an angle to include aspects of the side view.
1238,Does not realise the lines at an intersection have to be straight in order to show vertically opposite angles,Vertically Opposite Angles,Geometry,"The angle directly opposite the 50-degree angle, which also measures 50 degrees.",An angle adjacent to the 50-degree angle on the same line.,"In the diagram below, two lines intersect at a point. If one angle formed is 50 degrees, which angle would be its vertically opposite angle?",Does not realize the lines at an intersection have to be straight in order to show vertically opposite angles.
1239,Believes a cubic equation will have a quadratic graph,Understanding the graphical representation of polynomial equations.,Algebra and Graph Theory.,A cubic curve with one inflection point.,A parabolic curve.,What type of graph does the cubic equation \(y = x^3 - 2x^2 + x - 1\) produce?,Believes a cubic equation will have a quadratic graph.
1241,Subtracts instead of divides when division is written as a fraction,Solving proportions involving fractions,Ratios and Proportions,6,5.25,"If a recipe requires 3/4 cup of sugar for every 2 cups of flour, how many cups of sugar are needed if you use 8 cups of flour?",Subtracts instead of divides when division is written as a fraction
1242,Does not recognise the similar shape as the shape has been rotated and the scale factor is less than 1,Identifying similar shapes through rotation and scaling,Geometry,12 square centimeters,32 square centimeters,"Two rectangles are shown below. Rectangle A measures 8 cm by 6 cm. Rectangle B is a scaled-down version of Rectangle A and has been rotated 90 degrees. If the longest side of Rectangle B is 4 cm, what is the area of Rectangle B?",Does not recognise the similar shape as the shape has been rotated and the scale factor is less than 1
1243,Believes when given a fraction and an amount the question must be to find the fraction of the amount. ,Understanding division with fractions to determine quantity.,Fractions,8,4.5,"A recipe requires \(\frac{3}{4}\) cup of sugar for one batch. If Sarah has 6 cups of sugar, how many full batches can she make?",Believes when given a fraction and an amount the question must be to find the fraction of the amount.
1244,The student does not understand the place value of 3-digit numbers,Understanding Place Value in Three-Digit Numbers,Number Sense,70,"7, 700",What is the value of the digit 7 in the number 473?,The student does not understand the place value of 3-digit numbers.
1246,"When adding fractions, uses addition of the denominators as a common denominator",Adding Fractions with Different Denominators,Arithmetic,\( \frac{5}{6} \),\( \frac{2}{5} \),What is the sum of \( \frac{1}{2} + \frac{1}{3} \)?,"When adding fractions, uses addition of the denominators as a common denominator."
1247,Assumes you cannot use the fact that multiplication is commutative when simplifying an algebraic term. ,Commutative Property of Multiplication in Algebraic Expressions,Algebra,\(12xy + 6xy = 18xy\),\(12x \cdot 4y + 6x \cdot 3y\),Simplify the expression \(3x \cdot 4y + 2x \cdot 3y\).,Assumes you cannot use the fact that multiplication is commutative when simplifying an algebraic term.
1249,"Believes 'given that a, what is the probability of b?' means 'given that b, what is the probability of a?'",Conditional Probability Understanding,Probability,Cannot be determined from the given information.,60%,"If it is known that 60% of students who study mathematics also play musical instruments, what is the probability that a student who plays a musical instrument studies mathematics?","Believes 'given that a, what is the probability of b?' means 'given that b, what is the probability of a?'"
1253,"Thinks 1 cubic metre = 100,000 cubic centimetres",Cubic Metre to Cubic Centimetre Conversion,Measurement Conversion,"2,000,000 cubic centimetres","200,000 cubic centimetres","If a swimming pool has a volume of 2 cubic metres, how many cubic centimetres of water does it contain?","Thinks 1 cubic metre = 100,000 cubic centimetres"
1254,"Believes that if there are two unknowns in an equation, all integers must be possible solutions",Solving linear equations with two variables,Algebra,"(5, 5), (3, 7), (1, 9)","(2.5, 7.5), (-1, 11), (10, 0)","If \(x + y = 10\) and both \(x\) and \(y\) are integers, which of the following pairs could NOT be a solution for \((x, y)\)?","Believes that if there are two unknowns in an equation, all integers must be possible solutions."
1257,Assumes a 1/4 of a whole is 25,Converting Fractions to Percentages,Fractions and Percentages,25%,1/4,"If a pizza is cut into 4 equal slices and you eat 1 slice, what percentage of the pizza have you eaten?",Assumes a 1/4 of a whole is 25
1258,"When calculating a scale factor, thinks they need to subtract rather than divide.",Applying Scale Factors Correctly,Scale Factors and Ratios,150 miles,47 miles (3 inches * 50 miles - 50 miles),"A map has a scale of 1 inch representing 50 miles. If two cities are 3 inches apart on the map, how much farther apart are they in reality?","When calculating a scale factor, thinks they need to subtract rather than divide."
1262,"Believes that they can fully factorise an expression by taking out any common factor, not just the HCF",Factoring polynomials by finding the highest common factor (HCF),Algebra,\(4x(3x + 2)\),\(x(12x + 8)\),Factorise the expression \(12x^2 + 8x\).,"Believes that they can fully factorise an expression by taking out any common factor, not just the HCF"
1267,Identifies a number as a common factor but doesn't identify a letter as a common factor,Factoring expressions with common factors,Algebra,\(6xy(x + 2y)\),\(6x(x + 2y^2)\),Factor the expression \(6x^2y + 12xy^2\).,Identifies a number as a common factor but doesn't identify a letter as a common factor
1273,Thinks they start on the left when doing long multiplication ,Long Multiplication Process,Arithmetic,714,614,Multiply 34 by 21 using long multiplication. What is the correct product?,Thinks they start on the left when doing long multiplication
1275,Does not relate integers and fractions,Adding Integers and Fractions.,Arithmetic Operations with Fractions.,\( 3\frac{1}{2} \),\( 3.2 \),What is the result when you add \( \frac{1}{2} \) to \( 3 \)?,Does not relate integers and fractions.
1276,"Believes that the y intercept is (0, y) where y is any y coordinate on the line",Understanding the concept of y-intercept in linear equations,Algebra,"(0, 5)","(5, 0), (3, 5), (0, 3)",What is the y-intercept of the line represented by the equation \(y = 3x + 5\)?,"Believes that the y intercept is (0, y) where y is any y coordinate on the line"
1279,Confuses right angle triangles and equilateral triangles,Properties of Triangles.,Geometry.,There is no such triangle because a right angle triangle cannot have all sides equal.,It is an equilateral triangle.,"In a triangle, if one angle measures 90 degrees and all sides are equal, what type of triangle is it?",Confuses right angle triangles and equilateral triangles.
1281,Does not understand that similar shapes and enlarged shapes will have the same size angles as the original,Angle measures in similar triangles,Geometry,60 degrees,120 degrees,"Two similar triangles have side lengths in the ratio 1:2. If the smaller triangle has an angle measuring 60 degrees, what is the measure of the corresponding angle in the larger triangle?",Does not understand that similar shapes and enlarged shapes will have the same size angles as the original.
1284,Thinks only like terms can be multiplied,Multiplication of unlike algebraic terms,Algebra,\(6xy + 4x^2\),\(6x + 4x^2\),Simplify the expression \(2x \cdot 3y + 4x^2\).,Thinks only like terms can be multiplied
1286,believes the complement of a set consists of anything that is not just in that set,Complement of a Set Within a Universal Set,Set Theory,"{0, 4, 5}","{0, 1, 2, 3, 4, 5, ...}","If set A = {1, 2, 3}, which of the following represents the complement of set A within the universal set U = {0, 1, 2, 3, 4, 5}?","The complement of a set includes all possible numbers or elements in existence, not just those outside the set within a defined universal set."
1289,Does not understand that the area of an enlarged shape is the area of the original multiplied by the square of the scale factor of the lengths.,Area of Enlarged Shapes and Scale Factors,Geometry,64 cm²,16 cm²,"A square has a side length of 4 cm. If each side of the square is doubled, what is the new area of the square?",Does not understand that the area of an enlarged shape is the area of the original multiplied by the square of the scale factor of the lengths.
1296,Believes there are 90 degrees in a full turn,Angle Measurement in Circles,Geometry,360 degrees,90 degrees,How many degrees are in a full turn around a circle?,Believes there are 90 degrees in a full turn
1297,Believes you keep the divisor unchanged when dividing by a fraction,Dividing by a Fraction,Arithmetic Operations,15,\(\frac{5}{3}\),"If \(5 \div \frac{1}{3} = x\), what is the value of \(x\)?",Believes you keep the divisor unchanged when dividing by a fraction
1298,Thinks multiple letters can be subtracted at once in Roman numerals,Understanding of Roman Numeral Subtraction Rules,Number Systems,IX (9),"IC (99), XD (490)",Which of the following expressions correctly represents the subtraction in Roman numerals?,Thinks multiple letters can be subtracted at once in Roman numerals
1299,Ignores the zero when multiplying,Zero Place Value in Multiplication,Multiplication,1506,1502,Calculate the product of 502 and 3.,Ignores the zero when multiplying
1300,"In direct and inverse proportion, forgets to find the value of k, and carries out calculations as though k were 1",Direct Proportionality Calculation,Algebra,32,24,"If y is directly proportional to x, and y = 24 when x = 3, what is the value of y when x = 4?","Forgets to find the value of k, and carries out calculations as though k were 1."
1301,"When subtracting a surd from an integer, just subtracts the number under the surd from the integer",Subtracting Surds from Integers,Algebra,4,2,Simplify the expression \( 7 - \sqrt{9} \).,"When subtracting a surd from an integer, just subtracts the number under the surd from the integer"
1304,Confuses lines of the form y = a and y= ax,Understanding the equation of horizontal lines,Algebra,y = 5,x = 5,"Which equation represents a horizontal line passing through the point (3, 5)?",Confuses lines of the form y = a and y = ax
1309,Believes the numerator is the top of a fraction ,Reciprocal of Fractions,Fractions,4/3,3/4,What is the reciprocal of the fraction 3/4?,Believes the numerator is the top of a fraction
1314,Only uses the closest angle to the unknown when using the angles in a straight line relationship,Angles on a Straight Line.,Geometry.,100 degrees.,80 degrees.,"In the diagram below, lines \( AB \) and \( CD \) are straight. If \( \angle ABC = 50^\circ \) and \( \angle BCD = 130^\circ \), what is the measure of \( \angle ACB \)?",Only uses the closest angle to the unknown when using the angles in a straight line relationship.
1315,Rounds to the wrong degree of accuracy (nearest ten rather than nearest whole number),Rounding to Nearest Whole Number,Arithmetic,456,460,Round the number 456 to the nearest whole number.,Rounds to the wrong degree of accuracy (nearest ten rather than nearest whole number)
1317,Identifies wrong place value column after decimal point,Decimal Place Value Alignment in Addition,Decimal Arithmetic,42.658,43.558,What is the result of adding 34.567 to 8.091 if you incorrectly aligned the numbers by the ones place instead of the decimal?,Aligning numbers by the ones place instead of the decimal when adding decimals.
1323,"When multiplying surds in the form ✓a × b✓c, believes the answer is  ✓(abc)",Multiplication of Surds,Surd Operations,\( 2\sqrt{6} \),\( \sqrt{24} \),Simplify the expression \( \sqrt{2} \times \sqrt{3} \times \sqrt{4} \).,"When multiplying surds in the form \( \sqrt{a} \times \sqrt{b} \times \sqrt{c} \), believes the answer is \( \sqrt{abc} \)."
1325,Has found area of triangle rather than area of square,Area of a Square,Geometry,64 square units,32 square units,What is the area of a square with a side length of 8 units?,Has found area of triangle rather than area of square
1326,Does not know the meaning of square sign for right angle,Understanding of right angle notation in triangles.,Geometry,"The angle is a right angle, measuring exactly 90 degrees.","The angle is acute, measuring less than 90 degrees.","In a right triangle, if one of the angles is marked with a square sign, what does this indicate about the angle?",Does not know the meaning of square sign for right angle.
1328,"When reading off from the left side of a back to back stem and leaf, mixes up the value of the leaf and the stem",Reading Back-to-Back Stem-and-Leaf Plots Correctly,Statistics,37,73,"A back-to-back stem-and-leaf plot shows the number of books read by students in two different classes over the summer. For Class A, the plot reads 3|7 on the left side. How many books did this student in Class A read over the summer?","When reading off from the left side of a back to back stem and leaf, mixes up the value of the leaf and the stem"
1330,Believes they can still have the variable on both sides when making it the subject,Solving linear equations by isolating the variable,Algebra,\(x = 5\),"\(x = -5\), \(x = 10\)",Solve for \(x\) in the equation \(3x + 5 = 2x + 10\).,Believes they can still have the variable on both sides when making it the subject
1335,Believes volume of a cuboid is the area of the three unique faces multiplied together,Volume Calculation of Cuboids,Geometry,48 cubic cm,48 square cm,What is the volume of a cuboid with dimensions 6 cm by 4 cm by 2 cm?,Believes volume of a cuboid is the area of the three unique faces multiplied together
1337,Does not understand the phrase to the power of,Understanding exponential notation,Exponents,8,6,What is 2 to the power of 3?,"Does not understand the phrase ""to the power of"""
1339,Calculated the hours and minutes separately,Converting and Adding Time Durations,Time Calculation,10 hours,9 hours 30 minutes,"If it takes John 2 hours and 30 minutes to clean his room, and he cleans for 4 times that duration over the weekend, how long does he spend cleaning in total?",Calculated the hours and minutes separately
1341,Multiplies instead of divides by 100 when converting a percentage to a decimal,Conversion of percentages to decimals,Arithmetic,0.45,4500,What is the decimal equivalent of 45% if you correctly convert the percentage to a decimal?,Multiplies instead of divides by 100 when converting a percentage to a decimal
1342,"When adding decimals, does not keep place value the same as the original digits",Aligning decimal points when adding numbers with decimals,Arithmetic - Decimal Operations,19.134,19.224,What is the sum of 12.345 and 6.789?,"When adding decimals, does not keep place value the same as the original digits"
1343,"When substituting into an algebraic term, replaces variables with numbers without multiplying.",Substitution in Linear Expressions,Algebra,8,14,"If \(x = 3\) and \(y = -2\), what is the value of the expression \(4x + 2y\)?","When substituting into an algebraic term, replaces variables with numbers without multiplying."
1345,Inserts brackets but not changed order of operation,Applying Order of Operations with Parentheses,Arithmetic Operations,17,12,Simplify the expression \( 4 \times (2 + 3) - 5 \).,Inserts brackets but not changed order of operation
1346,Mixes up squaring with repeating a digit,Squaring a number,Arithmetic,9,33,What is the value of \(3^2\)?,Mixes up squaring with repeating a digit
1347,Believes a circle achieves what a perpendicular bisector does,Properties of Circles and Perpendicular Bisectors,Geometry,"The diameter of a circle divides the circle into two equal halves, similar to how a perpendicular bisector divides a line segment into two equal parts.","A circle acts as a perpendicular bisector for its diameter, ensuring all points on the circle are equidistant from the midpoint of the diameter.",What is the relationship between a circle and its diameter that is analogous to the relationship between a line segment and its perpendicular bisector?,Believes a circle achieves what a perpendicular bisector does.
1351,Does not know the meaning of congruent,Understanding of Congruence in Triangles.,Geometry.,"Two triangles are congruent if they have the same size and shape, which means all corresponding sides and angles are equal.",Two triangles are congruent if they look similar or have some sides and angles that match.,Which of the following statements correctly describes two triangles that are congruent?,Does not know the meaning of congruent.
1352,Believes cumulative frequency is plotted at the midpoint of the class,Understanding the correct plotting of cumulative frequency on a graph.,Statistics.,At the upper boundary of the class interval.,At the midpoint of the class interval.,"In a grouped frequency distribution, where should the cumulative frequency be plotted on a graph for each class interval?",Believes cumulative frequency is plotted at the midpoint of the class.
1353,Believes two odd numbers multiply to give an even number,Multiplication of Odd Numbers,Arithmetic,345,346,What is the product of 15 and 23?,Believes two odd numbers multiply to give an even number
1363,Uses 2 letters to describe an angle,Understanding angles in a right-angled isosceles triangle,Geometry,45 degrees,90 degrees,"What is the measure of angle XY in triangle XYZ, where X and Y are the endpoints of the hypotenuse and Z is the right angle, if the triangle is a right-angled isosceles triangle with hypotenuse length 2√2 units?",Uses 2 letters to describe an angle (XY)
1366,Subtracts instead of multiplies when using grid method,Area calculation using multiplication,Geometry,Multiply 12 meters by 8 meters.,Subtract 8 meters from 12 meters.,"A rectangular garden measures 12 meters by 8 meters. If you want to find the area of the garden, which operation should you use?",Subtracts instead of multiplies when using grid method
1368,Confuses parallel and transversal,Angle Relationships with Parallel Lines and Transversals,Geometry,75 degrees,105 degrees,"In the figure below, line m is parallel to line n and line t is a transversal. If angle 1 measures 75 degrees, what is the measure of angle 5?",Confuses parallel and transversal
1369,Halves the radius to find the diameter,Understanding Diameter Calculation,Geometry,16 cm,4 cm,A circle has a radius of 8 cm. What is the diameter of the circle?,Halves the radius to find the diameter
1372,Ordered from largest to smallest,Understanding Relative Magnitude of Rational Numbers,Comparing Fractions and Decimals,"0.75, 4/5, 2/3","4/5, 0.75, 2/3","Arrange the numbers 4/5, 0.75, and 2/3 in order from largest to smallest.","Believing that fractions with larger numerators are always larger than those with smaller numerators, regardless of the denominator."
1375,Confuses the radius and theta when working with sectors ,Area of a Sector,Geometry,12\(\pi\) square centimeters,72\(\pi\) square centimeters,What is the area of a sector with a central angle of \(120^\circ\) in a circle of radius 6 cm?,Confuses the radius and theta when working with sectors 
1377,Square roots when asked for second multiple,Properties of square roots and multiplication.,Algebra,8,"4, 32",What is the square root of 16 multiplied by the square root of 4?,"Students may think that when you multiply two square roots, you need to find the square root of their product instead of multiplying them directly."
1378,"When solving a problem using written division (bus-stop method), carries the wrong digit",Written Division (Bus-Stop Method),Arithmetic,121,113,Calculate \( 1452 \div 12 \).,Carrying the wrong digit during the division process.
1381,Believes the gradient is where the line intersects the y axis,Understanding the components of a linear equation,Algebra,3,2,What is the gradient of the linear equation \( y = 3x + 2 \)?,Believes the gradient is where the line intersects the y axis
1382,"When given two similar objects and asked to find the length scale factor, believes the length scale factor is the area scale factor",Understanding the relationship between length and area scale factors in similar figures.,Geometry,2,4,"Two similar rectangles have areas of 32 square units and 128 square units respectively. If the length of the smaller rectangle is 4 units, what is the length scale factor between the two rectangles?",Believes the length scale factor is the area scale factor.
