MisconceptionId,MisconceptionName,ConstructName,SubjectName,AnswerAText,AnswerBText,QuestionText,MisconceptionB
1220,Does not include zero when counting over zero,Counting Whole Numbers Excluding Zero,Basic Arithmetic,9,8,"How many numbers are there between 1 and 10, excluding zero?",Does not include zero when counting over zero
1221,Converts a decimal to a fraction by writing 1 over the digits of the decimal,Converting decimals to fractions in simplest form,Fractions and Decimals,3/4,"75/100, 0.75/1",Convert the decimal 0.75 into a fraction.,Converts a decimal to a fraction by writing 1 over the digits of the decimal.
1222,Forgets the denominator in probability,Understanding of basic probability calculation,Probability,5/12,5,"A bag contains 5 red marbles and 7 blue marbles. If one marble is drawn at random, what is the probability that it is red?",Forgets the denominator in probability
1223,Uses numerators to convert fractions to ratio despite different denominators,Understanding and comparing fractions by finding equivalent forms.,Fractions and Ratios.,"Comparing the fractions by finding a common denominator or converting them to decimals shows that \(\frac{24}{30} = 0.8\) and \(\frac{18}{25} = 0.72\), so Class A with \(\frac{24}{30}\) has a higher average score.","Since \(24 > 18\), Class A with \(\frac{24}{30}\) has a higher average score.","If two classes have test scores represented by the fractions \(\frac{24}{30}\) and \(\frac{18}{25}\), which class has a higher average score if you compare these fractions by their numerators?",Uses numerators to convert fractions to ratio despite different denominators.
1227,Forgets that a number without an indice is to the power of 1 ,Understanding of multiplying powers with the same base,Exponents,64,16,Simplify the expression \(4^2 \times 4\).,Forgets that a number without an indice is to the power of 1
1228,Believes sets are the same if the elements within them have a shared property,Equality of Sets Based on Elements,Set Theory,"{6, 4, 2}","{3, 6, 9}","Which of the following sets is equal to the set {2, 4, 6} based on the elements' properties?",Believes sets are the same if the elements within them have a shared property
1232,"Thinks the longest bar has the highest frequency on a pictogram, even if the symbols aren't evenly spaced",Understanding Frequency Representation in Pictograms,Data Interpretation,Monday,Tuesday,"A pictogram shows the number of apples sold each day. Each apple symbol represents 5 apples. If the bar for Monday has 4 apple symbols, Tuesday has 3 apple symbols that are not evenly spaced, and Wednesday has 2 apple symbols, which day had the most apples sold?","Thinks the longest bar has the highest frequency on a pictogram, even if the symbols aren't evenly spaced"
1236,Thinks the plan view is taken from an angle to include aspects of the side view and plan,Understanding of Plan and Elevation Views in 3D Shapes,Geometry,A square,A rectangle that is not a square,A student is looking at a 3D object and trying to match it with its correct 2D representation. Which of the following is the correct plan view for a cube?,Thinks the plan view is taken from an angle to include aspects of the side view and plan.
1238,Does not realise the lines at an intersection have to be straight in order to show vertically opposite angles,Understanding of vertically opposite angles.,Geometry.,50 degrees.,130 degrees.,"In the figure below, two straight lines intersect at a point. If angle A is 50 degrees, what is the measure of angle C?",Does not realize the lines at an intersection have to be straight in order to show vertically opposite angles.
1239,Believes a cubic equation will have a quadratic graph,Understanding the graphical representation of cubic equations.,Algebra,"A graph showing a curve with one inflection point, resembling an S-shape or a Z-shape.","A graph showing a parabolic shape, similar to a quadratic equation.",Which of the following graphs could represent a cubic equation \( y = ax^3 + bx^2 + cx + d \)?,Believes a cubic equation will have a quadratic graph.
1241,Subtracts instead of divides when division is written as a fraction,Dividing fractions by understanding the concept of halving a fraction,Fractions,3/8,1/2,"If a recipe calls for 3/4 cup of sugar and you only want to make half of the recipe, how much sugar should you use?",Subtracts instead of divides when division is written as a fraction
1242,Does not recognise the similar shape as the shape has been rotated and the scale factor is less than 1,Identifying lengths in similar triangles under transformations,Geometry,5 cm,10 cm,"Triangle ABC is similar to triangle DEF, but triangle DEF has been rotated 90 degrees clockwise and scaled down by a factor of 0.5. If the length of AB is 10 cm, what is the length of DE?",Does not recognise the similar shape as the shape has been rotated and the scale factor is less than 1
1243,Believes when given a fraction and an amount the question must be to find the fraction of the amount. ,Understanding subtraction involving fractions of quantities.,Arithmetic,8,4,"If there are 12 apples and you take away 1/3 of them, how many apples do you have left?",Believes when given a fraction and an amount the question must be to find the fraction of the amount.
1244,The student does not understand the place value of 3-digit numbers,Understanding Place Value in Three-Digit Numbers,Number Sense,50,"5, 500",What is the value of the digit 5 in the number 257?,The student does not understand the place value of 3-digit numbers
1245,Believes a number written in standard form with a negative power creates a larger number than that with a positive power,Understanding the effect of negative exponents on the magnitude of a number,Exponents and Powers,\(10^{-3}\),\(10^{3}\),Which of the following numbers is the smallest?,Believes a number written in standard form with a negative power creates a larger number than that with a positive power
1246,"When adding fractions, uses addition of the denominators as a common denominator",Adding fractions with unlike denominators,Arithmetic - Fractions,\(\frac{5}{6}\),\(\frac{1}{5}\),What is the sum of \(\frac{1}{2}\) and \(\frac{1}{3}\)?,"When adding fractions, uses addition of the denominators as a common denominator"
1247,Assumes you cannot use the fact that multiplication is commutative when simplifying an algebraic term. ,Commutative Property of Multiplication in Algebraic Expressions,Algebra,\(12xy + 10xy = 22xy\),\(3x4y + 2x5y = 7x9y\),Simplify the expression \(3x \cdot 4y + 2x \cdot 5y\).,Assumes you cannot use the fact that multiplication is commutative when simplifying an algebraic term.
1249,"Believes 'given that a, what is the probability of b?' means 'given that b, what is the probability of a?'",Complementary Probabilities,Probability Theory,1/2,"1/2 (This answer is based on the misconception that if the probability of one event is given, the probability of the opposite event is the same due to misunderstanding the concept of complementary probabilities.)","If the probability of drawing a red card from a standard deck of cards is given as 1/2, what is the probability of drawing a black card?","Believes 'given that a, what is the probability of b?' means 'given that b, what is the probability of a?'"
1253,"Thinks 1 cubic metre = 100,000 cubic centimetres",Understanding of cubic meter to cubic centimeter conversion,Volume Conversion,"2,000,000 cubic centimeters","200,000 cubic centimeters",How many cubic centimeters are there in 2 cubic meters?,"Thinks 1 cubic metre = 100,000 cubic centimetres"
1254,"Believes that if there are two unknowns in an equation, all integers must be possible solutions",Solving systems of linear equations with two variables,Algebra,"(6, 4)","(5, 5), (-2, -12), (10, 0)","If \(x + y = 10\) and \(x - y = 2\), which of the following pairs of integers could be the values of \(x\) and \(y\)?","Believes that if there are two unknowns in an equation, all integers must be possible solutions."
1257,Assumes a 1/4 of a whole is 25,Converting Fractions to Percentages,Fractions and Percentages,25%,1/4,"If a pizza is cut into 4 equal slices and John eats 1 slice, what percentage of the pizza has John eaten?",Assumes a 1/4 of a whole is 25
1258,"When calculating a scale factor, thinks they need to subtract rather than divide.",Scale Factor Calculation,Geometry,3,12,"If the length of a rectangle is scaled up by a factor to become 18 units from its original length of 6 units, what is the scale factor?","When calculating a scale factor, thinks they need to subtract rather than divide."
1267,Identifies a number as a common factor but doesn't identify a letter as a common factor,Factoring polynomials by identifying greatest common factors,Algebra,\(3x(2x + 1)\),\(6(x^2 + \frac{1}{2}x)\),Factor the expression \(6x^2 + 3x\).,Identifies a number as a common factor but doesn't identify a letter as a common factor
1273,Thinks they start on the left when doing long multiplication ,Long Multiplication Process,Arithmetic,7935,2305,Multiply 345 by 23 using long multiplication. What is the correct product?,Thinks they start on the left when doing long multiplication
1275,Does not relate integers and fractions,Understanding relationships between fractions and their equivalent whole numbers representations,Fractions,6,"3, 8, 12","If \( \frac{1}{2} \) of a number is 4, what is \( \frac{3}{4} \) of the same number?",Does not relate integers and fractions
1276,"Believes that the y intercept is (0, y) where y is any y coordinate on the line",Understanding the concept of y-intercept in linear equations,Algebra,"(0, 3)","(3, 0), (2, 3), (0, y)",What is the y-intercept of the line represented by the equation y = 2x + 3?,"Believes that the y intercept is (0, y) where y is any y coordinate on the line"
1279,Confuses right angle triangles and equilateral triangles,Triangle Classification,Geometry,Right triangle,Equilateral triangle,"If a triangle has one 90-degree angle, which type of triangle is it?",Confuses right angle triangles and equilateral triangles
1281,Does not understand that similar shapes and enlarged shapes will have the same size angles as the original,Angle preservation in similar figures,Geometry,45 degrees,90 degrees,"Two triangles, Triangle ABC and Triangle DEF, are similar. If angle A measures 45 degrees, what is the measure of angle D?",Does not understand that similar shapes and enlarged shapes will have the same size angles as the original
1284,Thinks only like terms can be multiplied,Multiplication of unlike algebraic terms,Algebra,\(12xy\),"\(7xy\), \(3xy + 4xy\)",Simplify the expression \(3x \cdot 4y\).,Thinks only like terms can be multiplied
1285,Believes a vertical line has equation y=,Understanding the Equation of Vertical Lines,Coordinate Geometry,x = 4,y = -2,"What is the equation of a vertical line passing through the point (4, -2)?",Believes a vertical line has equation y=
1286,believes the complement of a set consists of anything that is not just in that set,Complement of a Set in a Universal Set,Set Theory,"{4, 5, 6}","{0, 4, 5, 6, 7, 8, ...}","If the set A = {1, 2, 3}, which of the following represents the complement of set A in the universal set U = {1, 2, 3, 4, 5, 6}?",Believes the complement of a set consists of anything that is not just in that set.
1289,Does not understand that the area of an enlarged shape is the area of the original multiplied by the square of the scale factor of the lengths.,Area Scaling with Dimension Increase,Geometry,9,3,"If a rectangle's length and width are both tripled, by what factor does the area increase?",Does not understand that the area of an enlarged shape is the area of the original multiplied by the square of the scale factor of the lengths.
1296,Believes there are 90 degrees in a full turn,Understanding of angle measurement in full turns,Geometry,900 degrees,225 degrees,How many degrees are there in two and a half full turns?,Believes there are 90 degrees in a full turn
1297,Believes you keep the divisor unchanged when dividing by a fraction,Dividing Fractions by Inverting and Multiplying,Arithmetic Operations with Fractions,\( \frac{3}{2} \),\( \frac{3}{8} \),What is the result of dividing \( \frac{3}{4} \) by \( \frac{1}{2} \)?,Believes you keep the divisor unchanged when dividing by a fraction
1298,Thinks multiple letters can be subtracted at once in Roman numerals,Subtraction using Roman Numerals,Number System,VII,IX,What is the result when you subtract XVI from XXIII?,Thinks multiple letters can be subtracted at once in Roman numerals
1299,Ignores the zero when multiplying,Understanding place value in multiplication,Multiplication with whole numbers,1506,156,What is the product of 502 and 3?,Ignores the zero when multiplying
1300,"In direct and inverse proportion, forgets to find the value of k, and carries out calculations as though k were 1",Direct Proportionality and Constant of Variation,Algebra,32,16,"If \( y \) varies directly with \( x \), and \( y = 20 \) when \( x = 5 \), what is the value of \( y \) when \( x = 8 \)?","In direct and inverse proportion, forgets to find the value of k, and carries out calculations as though k were 1"
1301,"When subtracting a surd from an integer, just subtracts the number under the surd from the integer",Subtracting Surds from Integers,Algebra,3,1,What is the result of \( 5 - \sqrt{4} \)?,"When subtracting a surd from an integer, just subtracts the number under the surd from the integer."
1304,Confuses lines of the form y = a and y= ax,Understanding Horizontal Lines in Coordinate Geometry,Algebra,y = 3,y = 4x,"Which equation represents a horizontal line passing through the point (4, 3)?",Confuses lines of the form y = a and y = ax
1305,believes that a fraction with the largest denominator will be smallest regardless of the numerator,Understanding the role of both numerator and denominator in determining the value of a fraction,Fractions,3/8,"1/12, 2/16, 4/32",Which of the following fractions is the smallest?,Believes that a fraction with the largest denominator will be smallest regardless of the numerator
1309,Believes the numerator is the top of a fraction ,Understanding Numerator and Denominator Positions,Fractions,3/4,4/3,"If a student believes that the numerator is always the top number in a fraction, which of the following fractions correctly represents 3 out of 4 equal parts shaded in a diagram?",Believes the numerator is the top of a fraction
1314,Only uses the closest angle to the unknown when using the angles in a straight line relationship,Angles formed by parallel lines and a transversal.,Geometry.,60 degrees.,120 degrees.,"In the diagram below, lines m and n are parallel, and line t is a transversal. If the measure of angle 1 is 120 degrees, what is the measure of angle 5?",Only uses the closest angle to the unknown when using the angles in a straight line relationship.
1315,Rounds to the wrong degree of accuracy (nearest ten rather than nearest whole number),Rounding to the Nearest Whole Number,Arithmetic,437,440,Round the number 437 to the nearest whole number.,Rounds to the wrong degree of accuracy (nearest ten rather than nearest whole number)
1317,Identifies wrong place value column after decimal point,Adding decimals with correct alignment of decimal points,Decimal Arithmetic,1.23,1.13,What is the sum of 0.45 and 0.78?,Adding tenths to hundredths (misplacing the decimal)
1323,"When multiplying surds in the form ✓a × b✓c, believes the answer is  ✓(abc)",Multiplication of Surds - Correct Application of Radical Rules,Algebra - Surds and Radicals,6,\( \sqrt{36} \),Simplify the expression \( \sqrt{3} \times \sqrt{12} \).,"When multiplying surds in the form \( \sqrt{a} \times \sqrt{b} \), believes the answer is \( \sqrt{ab} \)."
1325,Has found area of triangle rather than area of square,Area of a Square.,Geometry.,64 square units.,32 square units.,"What is the area of a square with a side length of 8 units, if someone has calculated the area as 32 square units?",Has found area of triangle rather than area of square.
1326,Does not know the meaning of square sign for right angle,"Understanding symbols in geometry, specifically the square sign for right angles.",Geometry,"It indicates a right angle, measuring 90 degrees.",It indicates an equilateral triangle.,What does the square sign (∟) indicate in a triangle?,Does not know the meaning of square sign for right angle
1328,"When reading off from the left side of a back to back stem and leaf, mixes up the value of the leaf and the stem",Reading Back-to-Back Stem-and-Leaf Plots Correctly,Statistics,75,57,"Consider the back-to-back stem-and-leaf plot comparing test scores for two classes. On the left side, representing Class A, there is a stem of 7 with leaves 5, 6, and 8. What is the correct interpretation of the lowest score for Class A?","When reading off from the left side of a back to back stem and leaf, mixes up the value of the leaf and the stem"
1330,Believes they can still have the variable on both sides when making it the subject,Solving linear equations by isolating the variable,Algebra,\(x = 5\),\(x = 3\),"If \(3x + 5 = 2x + 10\), what is the value of \(x\)?",Believes they can still have the variable on both sides when making it the subject
1331,Believes angles in a quadrilateral sum to 450 degrees,Sum of Interior Angles of Polygons,Geometry,360 degrees,450 degrees,What is the sum of the interior angles of a quadrilateral?,Believes angles in a quadrilateral sum to 450 degrees
1335,Believes volume of a cuboid is the area of the three unique faces multiplied together,Volume of a Cuboid,Geometry,120 cubic centimeters,120 square centimeters,"What is the volume of a cuboid with side lengths of 4 cm, 5 cm, and 6 cm?",Believes volume of a cuboid is the area of the three unique faces multiplied together
1337,Does not understand the phrase to the power of,Understanding of Exponentiation,Exponents,8,6,What is the value of \(2\) to the power of \(3\)?,Does not understand the phrase to the power of
1339,Calculated the hours and minutes separately,Adding time durations correctly by converting units when necessary,Time and Measurement,7 hours and 30 minutes,6 hours and 90 minutes,"If it takes 3 hours and 45 minutes for a train to travel from Town A to Town B, how long will it take for the same train to make a round trip, assuming the return journey takes the same amount of time?",Calculated the hours and minutes separately
1341,Multiplies instead of divides by 100 when converting a percentage to a decimal,Converting percentages to decimals for calculating sale prices,Arithmetic,0.75,25,"If a store is having a sale and everything is reduced by 25%, what decimal should you multiply the original price by to find the sale price?",Multiplies instead of divides by 100 when converting a percentage to a decimal
1342,"When adding decimals, does not keep place value the same as the original digits",Place Value in Decimal Addition,Decimal Arithmetic,8.023,7.103,What is the sum of 5.678 and 2.345?,"When adding decimals, does not keep place value the same as the original digits"
1343,"When substituting into an algebraic term, replaces variables with numbers without multiplying.",Substitution and Evaluation of Algebraic Expressions,Algebra,7,12,"If \( x = 3 \), what is the value of \( 4x - 5 \)?","When substituting into an algebraic term, replaces variables with numbers without multiplying."
1345,Inserts brackets but not changed order of operation,Order of Operations with Parentheses,Arithmetic Operations,5,8,Simplify the expression \( 2 + 3 \times (4 - 1) \).,Inserts brackets but not changed order of operation
1346,Mixes up squaring with repeating a digit,Squaring a number,Arithmetic,1024,332,What is the value of \(32\) squared?,Mixes up squaring with repeating a digit
1347,Believes a circle achieves what a perpendicular bisector does,Properties of Perpendicular Bisectors in Circles,Geometry,It passes through the center of the circle.,It divides the circle into two equal halves.,What property does the perpendicular bisector of a chord in a circle have that the chord itself does not?,Believes a circle achieves what a perpendicular bisector does.
1351,Does not know the meaning of congruent,Understanding of Congruence in Triangles.,Geometry.,Two triangles that have the same size and shape.,Two triangles that look similar but one is slightly bigger than the other.,Which of the following pairs of triangles are congruent?,Does not know the meaning of congruent.
1352,Believes cumulative frequency is plotted at the midpoint of the class,Plotting Cumulative Frequency on a Graph,Statistics,At the upper boundary of the class interval.,At the midpoint of the class interval.,"In a grouped frequency distribution table, if the cumulative frequency for a class interval is given as 45, where should this value be plotted on a cumulative frequency graph according to the correct understanding?",Believes cumulative frequency is plotted at the midpoint of the class.
1353,Believes two odd numbers multiply to give an even number,Multiplication of Odd Numbers,Arithmetic,63,62,What is the product of 7 and 9?,Believes two odd numbers multiply to give an even number
1355,Removes a zero from within the digits when rounding,Rounding to the Nearest Hundred,Rounding Numbers,500,50,Round the number 504 to the nearest hundred.,Removes a zero from within the digits when rounding
1359,Does not know how to round up when a decimal place value column contains a 9,Rounding with carry-over from 9s in decimal places,Arithmetic,8.00,7.99,What is the result of rounding 7.995 to the nearest hundredth?,Does not know how to round up when a decimal place value column contains a 9
1363,Uses 2 letters to describe an angle,Angle measurement on a straight line,Geometry,60°,120°,What is the measure of angle XY if ∠XY is part of a straight line and ∠YZ measures 120°?,Uses 2 letters to describe an angle
1366,Subtracts instead of multiplies when using grid method,Multiplication using the grid method,Arithmetic,156,1,"If you use the grid method to multiply 12 by 13, what is the correct product?",Subtracts instead of multiplies when using grid method
1368,Confuses parallel and transversal,Identifying parallel lines using properties of transversals,Geometry,"Line p, which lies in the same plane as lines m and n and never intersects line m.","Line q, which intersects line m at a different point than where line n intersects line m.",Which line is parallel to line m if line n is a transversal and the corresponding angles are congruent?,Confuses parallel and transversal
1369,Halves the radius to find the diameter,Understanding the relationship between radius and diameter of a circle,Geometry,12 cm,3 cm,"If the radius of a circle is 6 cm, what is the diameter of the circle?",Halves the radius to find the diameter
1372,Ordered from largest to smallest,Understanding of numerical order and magnitude,Number Sense,"7, 5, 3, 1","1, 3, 5, 7",Which of the following lists of numbers is ordered from largest to smallest?,Numbers with fewer digits are always smaller.
1375,Confuses the radius and theta when working with sectors ,Area of a Sector Calculation.,Geometry.,\(32\pi/3\) square units.,\(48\pi/3\) square units.,What is the area of a sector with a central angle of 60 degrees in a circle of radius 8 units?,Confuses the radius and theta when working with sectors.
1377,Square roots when asked for second multiple,Solving quadratic equations by taking square roots,Algebra,4,16,"If \(x^2 = 16\), what is one possible value of \(x\)?",Square roots when asked for second multiple
1378,"When solving a problem using written division (bus-stop method), carries the wrong digit",Written Division Method (Bus-Stop Method) - Correct Carrying of Digits,Arithmetic - Division,23,25,Divide 138 by 6 using the written division method. What is the correct quotient?,"When solving a problem using written division (bus-stop method), carries the wrong digit"
1381,Believes the gradient is where the line intersects the y axis,Understanding the components of linear equations,Algebra,3,2,What is the gradient of the line represented by the equation \(y = 3x + 2\)?,Believes the gradient is where the line intersects the y axis
1382,"When given two similar objects and asked to find the length scale factor, believes the length scale factor is the area scale factor",Understanding Scale Factors in Similar Figures,Geometry,2,4,"If a small cube has a surface area of 6 square meters and a larger cube has a surface area of 24 square meters, what is the length scale factor between the small cube and the larger cube?","When given two similar objects and asked to find the length scale factor, believes the length scale factor is the area scale factor."
1385,Struggles to draw 3D shapes on isometric paper,Drawing 3D shapes on isometric paper.,Geometry,"They may not align the edges of the cube properly with the grid lines, resulting in a distorted shape.","They will draw the cube as a perfect square, ignoring the perspective required for 3D representation.",A student is asked to draw a cube on isometric paper. Which of the following statements best describes a common mistake they might make due to struggling with drawing 3D shapes on isometric paper?,Struggles to draw 3D shapes on isometric paper.
1387,Does not understand the effect of consecutive subtractions,Understanding the cumulative effect of increasing subtractions in a sequence,Arithmetic Sequences,$35,$50,"If you start with $100 and subtract $5 on the first day, then subtract $10 on the second day, and continue by increasing the amount you subtract by $5 each day, how much will you have left after 5 days?",Does not understand the effect of consecutive subtractions
