MisconceptionId,MisconceptionName,ConstructName,SubjectName,AnswerAText,AnswerBText,QuestionText,MisconceptionB
5,"When measuring a reflex angle, gives the acute or obtuse angle that sums to 360 instead",Understanding of reflex angles and clock angles,Geometry,250 degrees,110 degrees,What is the measure of the reflex angle formed by the minute hand and the hour hand on a clock when it is 4:20?,"When measuring a reflex angle, gives the acute or obtuse angle that sums to 360 instead"
7,Believes gradient = change in y,Understanding Gradient Calculation,Coordinate Geometry,1,4,"A student believes that the gradient of a line on a graph is simply the change in y-coordinates between two points. If there are two points on a line, (3, 5) and (7, 9), what does this student incorrectly calculate as the gradient of the line?",Believes gradient = change in y
10,"Believes duration can be read from a timetable, rather than calculating from start and end times",Calculating time intervals,Time and Duration,4 hours and 30 minutes,From 9:15 AM to 1:45 PM,"A train departs from City A at 9:15 AM and arrives in City B at 1:45 PM on the same day. According to a student who believes that duration can be read directly from a timetable, how long does the journey take?","Believes duration can be read from a timetable, rather than calculating from start and end times"
12,Thinks that the side view does not include the furthest rows back,Understanding side views and calculating areas of rectangles.,Geometry.,15 square centimeters.,24 square centimeters.,"A rectangular prism has dimensions 8 cm x 5 cm x 3 cm. If you look at the side view from the perspective where the width and height are visible, what is the area of this side view?",Thinks that the side view does not include the furthest rows back.
13,"Does not subtract from the hours, when having to borrow for a time calculation",Subtracting time with borrowing across hours,Time Calculations,3 hours and 25 minutes,3 hours and 10 minutes,"If a train departs at 2:45 PM and arrives at its destination at 6:10 PM on the same day, how long was the journey?","Does not subtract from the hours, when having to borrow for a time calculation"
17,Confuses AM and PM when calculating time,Understanding AM and PM in Time Differences,Time Calculation,2 hours and 15 minutes,2 hours and 45 minutes,"If a train departs at 10:30 AM and arrives at its destination at 12:45 PM on the same day, how long was the journey?",Confuses AM and PM when calculating time
18,"Given the length of the sides, still does not recognise there is enough information to find the area",Area Calculation for Rectangles,Geometry,Multiply the length by the width (96 cm²).,Add the lengths of all four sides (40 cm).,"If a rectangle has sides measuring 8 cm and 12 cm, which of the following represents the correct method to calculate its area?",Believing that the area can be found by adding the lengths of the sides instead of multiplying them.
20,Believes the number of wholes in a mixed number multiplies by the fraction part,Multiplying Mixed Numbers,Fractions,14,12,What is the result of multiplying the mixed number \(2\frac{1}{3}\) by 6?,Believes the number of wholes in a mixed number multiplies by the fraction part
24,Does not understand the term multiple,Understanding Multiples,Number Theory,16,7,Which of the following numbers is a multiple of 4?,Does not understand the term multiple
25,Does not realise that when you multiply by 0 the answer will always be 0,Multiplication by Zero,Arithmetic,0,5,"If you have 5 apples and you multiply them by 0, how many apples do you have left?",Does not realise that when you multiply by 0 the answer will always be 0
27,Believes squaring a fraction requires you to double both parts,Squaring Fractions,Arithmetic,\( \frac{9}{16} \),\( \frac{6}{8} \),"If you square the fraction \( \frac{3}{4} \), what is the resulting fraction?",Believes squaring a fraction requires you to double both parts
30,"When asked for a number n times smaller or bigger, subtracts or adds n",Understanding of exponential growth versus linear addition,Exponential Growth,8 times larger,6 times larger,"If a certain bacteria population doubles every hour, how many times larger will the population be after 3 hours compared to its size now?","When asked for a number n times larger, adds n instead of calculating the exponential growth."
34,Believes dividing a negative by a positive gives a positive answer,Division of Integers,Arithmetic,\(-4\),\(4\),What is the result of \(-12 \div 3\)?,Believes dividing a negative by a positive gives a positive answer
35,Believes you add 2 instead of subtracting 2 to the numbers of sides when finding total interior angles,Sum of Interior Angles of Polygons,Geometry,540 degrees,720 degrees,What is the sum of the interior angles of a pentagon if you mistakenly add 2 to the number of sides when using the formula \(180(n-2)\)?,Believes you add 2 instead of subtracting 2 to the numbers of sides when finding total interior angles
36,Enlarges by the wrong centre of enlargement,Transformation - Enlargement by a correct center of enlargement,Geometry,The new square will be positioned such that its center is twice as far from the original center as the chosen external point is from the original center.,The new square will be in the same position as if it were enlarged from the geometric center.,"A square with a side length of 6 units is enlarged by a scale factor of 2. If a student mistakenly enlarges the square using a point outside the square as the center of enlargement instead of its geometric center, what will be the position of the new square relative to the original?",Enlarges by the wrong centre of enlargement
39,Multiplies by 1000 instead of 100 when converting a decimal to a percentage,Converting decimals to percentages,Arithmetic,35%,350%,"If the decimal 0.35 represents the portion of students who prefer online classes, what is the correct percentage of students preferring online classes?",Multiplies by 1000 instead of 100 when converting a decimal to a percentage
40,Believes midpoint multiplied by frequency is equivalent to frequency density,Understanding Frequency Density Calculation in Grouped Data,Statistics,"This calculation actually finds the total value for that class interval, not the frequency density.",This calculation gives the frequency density directly.,"In a grouped frequency distribution, if a student multiplies the midpoint of a class interval by its frequency to find the frequency density, what is the correct interpretation of this calculation?",Believes midpoint multiplied by frequency is equivalent to frequency density.
41,Believes the mean is the number of categories given divided by something,Understanding the concept of mean in categorical data analysis,Statistics,"The question is flawed because each student can only choose one category, so there is no mean number of categories per student. (Correct understanding)","2.5 (Incorrect application of the given misconception, dividing the number of categories by the total number of students)","A survey was conducted among 50 students to find out their favorite subject. If 10 students chose Math, 15 chose Science, 20 chose English, and 5 chose History, what is the mean number of categories each student chose?",Believes the mean is the number of categories given divided by something
43,Confuses the terms edges and vertices,Understanding the properties of three-dimensional shapes,Geometry,8,12,How many vertices does a cube have if it is often mistakenly referred to as having 12 edges instead?,Confuses the terms edges and vertices
44,"When adding or subtracting surds, just adds or subtracts the numbers under the surd rather than first trying to simplifying to find like surds",Adding and Subtracting Surds,Algebra,\(7\sqrt{2}\),\(5\sqrt{10}\),Simplify \(3\sqrt{2} + 2\sqrt{8}\).,"When adding or subtracting surds, just adds or subtracts the numbers under the surd rather than first trying to simplifying to find like surds."
46,Does not realise that division can be broken down into factors,Understanding Division as Factorization,Arithmetic,It equals 6 because 18 is composed of 6 groups of 3.,It equals 5 because dividing by 3 means subtracting 3 once from 18.,"If \( \frac{12}{3} = 4 \), then which of the following is true for \( \frac{18}{3} \)?",Does not realise that division can be broken down into factors.
49,Doesn't believe that when you divide by 0 the answer will always be 0,Division by Zero Concept,Arithmetic,Undefined or error,0,What is the result of dividing any non-zero number by zero?,Doesn't believe that when you divide by 0 the answer will always be 0
50,"When given a non-unit fraction of an amount and asked to find the total, answers as if it had been the unit fraction",Finding the whole from a part using fractions,Fractions,24,13.5,"If 3/4 of a number is 18, what is the number?","When given a non-unit fraction of an amount and asked to find the total, answers as if it had been the unit fraction (i.e., calculates as if 1/4 of the number is 18)."
53,Thinks circumference is radius x pi,Circumference of a Circle,Geometry,8π,4π,What is the circumference of a circle with a radius of 4 units?,Thinks circumference is radius x pi
56,Assumes a negative number is not rational,Rational Numbers Identification,Number Theory,√2,-3/4,Which of the following numbers is NOT a rational number?,Assumes a negative number is not rational
59,Cannot identify a common factor when simplifying algebraic fractions,Simplifying algebraic fractions by identifying common factors,Algebra,\(2x + 3\),\(2x^2 + 3x\),Simplify the fraction \(\frac{6x^2 + 9x}{3x}\).,Cannot identify a common factor when simplifying algebraic fractions
62,Does not realise that a curved line represents a changing gradient,Understanding of derivative as a measure of rate of change.,Calculus,The curve indicates that the rate of change of the function is not constant; it is increasing or decreasing.,The curve means there is no rate of change because the line is not straight.,"A student plots the graph of a function and observes a curved line. They claim that since the line is not straight, the function does not have any rate of change. How should the student correctly interpret the curve?",Does not realise that a curved line represents a changing gradient.
63,Believes 'data' and 'sample' are interchangeable,Distinguishing between sample and data in statistical studies,Statistics,Sample,Data,"In a study about the average height of students in a country, a researcher collected data from 100 randomly selected students. Which term correctly describes the 100 students in this context?",Believes 'data' and 'sample' are interchangeable
65,Cannot spot a variable within a written scenario,Multiplication and Addition in Word Problems,Arithmetic,360,240,"A local bakery sold 120 cupcakes on Monday. If they sold twice as many cupcakes on Tuesday as they did on Monday, how many cupcakes did they sell in total on both days?",Cannot spot a variable within a written scenario
67,Divides by 1000 instead of 100 when converting a decimal to a percentage,Converting decimals to percentages,Arithmetic,75%,0.0075%,"If a student scored 0.75 on a test, what is their score as a percentage?",Divides by 1000 instead of 100 when converting a decimal to a percentage
69,"When given a non-unit fraction of an amount, treats it like a unit fraction",Understanding scaling of fractions,Fractions,24,12,"If 1/4 of a number is 12, what is 2/4 of the same number?","When given a non-unit fraction of an amount, treats it like a unit fraction"
72,Thinks a decimal can be written as a fraction by just writing it under a numerator of 1,Converting Decimals to Fractions,Fractions and Decimals,2/5,0.4/1,What is the correct way to express the decimal 0.4 as a fraction?,Thinks a decimal can be written as a fraction by just writing it under a numerator of 1
73,Confuses a function with an expression,Evaluating Functions,Algebra,11,2x + 7,What is the value of \(f(x) = 2x + 3\) when \(x = 4\)?,Confuses a function with an expression
75,Believes that the directions of positive and negative vectors are the opposite way around.,Understanding the concept of negative vectors and their direction.,Vector Algebra,The direction of \( -\vec{A} \) is from point Q to point P.,The direction of \( -\vec{A} \) is from point P to point Q.,"If vector \( \vec{A} \) has a direction from point P to point Q, which statement correctly describes the direction of its negative vector \( -\vec{A} \)?",Believes that the directions of positive and negative vectors are the opposite way around.
79,Does not understand how to divide algebraic terms,Dividing algebraic terms with variables,Algebra,\(\frac{x}{3y}\),"\(\frac{1}{3}\), assuming that \(x\) and \(y\) cancel out completely because they appear in both the numerator and the denominator.",Simplify the expression \(\frac{4x^2y}{12xy^2}\).,Does not understand how to divide algebraic terms.
80,Thinks you can ignore the variable when simplifying algebraic fractions,Simplifying Algebraic Fractions,Algebra,\( \frac{1}{2} \),\( 1 \),Simplify the fraction \(\frac{4x}{8x}\).,Thinks you can ignore the variable when simplifying algebraic fractions
87,Does not know what an exterior angle is ,Understanding of Exterior Angles in Triangles,Geometry,130 degrees,"110 degrees, 90 degrees, 70 degrees",What is the measure of an exterior angle of a triangle if one of its interior angles is 50 degrees and another is 60 degrees?,Does not know what an exterior angle is
90,Does not understand place value after the decimal point,Identifying the tenths place in a decimal number,Decimal Place Value,4,"5, 6, 0","If you have the number 0.456, which digit represents the tenths place?",Does not understand place value after the decimal point
92,"When identifying the center of rotation, writes down the origin",Identifying the Center of Rotation in Transformations,Geometry,Any point outside both the original and the image triangles that does not coincide with the actual center of rotation.,"The origin (0,0) assuming the coordinate system is not necessarily aligned with the figure.",A triangle has been rotated about a point to form its image. Which point could NOT be the center of rotation if the original and the image triangles do not overlap?,"When identifying the center of rotation, writes down the origin."
93,"When multiplying a surd of the form a✓b by an integer, believes the integer and the number under the surd are multiplied",Multiplication of integers with surds,Algebra,6,12,What is the result of \(3 \times \sqrt{4}\)?,"When multiplying a surd of the form \(a\sqrt{b}\) by an integer, believes the integer and the number under the surd are multiplied."
94,"When solving simultaneous equations, thinks they can add variables to one of the equations to make terms across the 2 equations identical",Solving Systems of Linear Equations by Elimination,Algebra,2,3,Solve the system of equations \(3x + 2y = 14\) and \(5x - y = 9\). What is the value of \(x\)?,"When solving simultaneous equations, thinks they can add variables to one of the equations to make terms across the 2 equations identical"
96,Multiplies surds when asked to add,Addition of Surds,Algebra,\( 3\sqrt{3} \),\( \sqrt{15} \),Simplify the expression \( \sqrt{3} + \sqrt{12} \).,Multiplies surds when asked to add
100,Believes angles in a triangle sum to 360 degrees,Sum of Interior Angles in a Triangle,Geometry,180 degrees,360 degrees,What is the sum of the interior angles in a triangle?,Believes angles in a triangle sum to 360 degrees
104,Assumes a sequence is linear,Understanding Non-linear Sequence Patterns,Sequences and Series,28,30,"A sequence starts with the number 5, and each subsequent term increases by 3, then by 4, then by 5, and so on. What is the 6th term in the sequence?",Assumes a sequence is linear
106,Believes an arrowhead has four equal sides,Understanding the properties of geometric shapes and calculating perimeters,Geometry,40 units,"10 units, 20 units, 30 units","An arrowhead is placed on a coordinate plane. If one of its sides lies along the x-axis and the length of this side is 10 units, what could be the perimeter of the arrowhead if it has four equal sides?",Believes an arrowhead has four equal sides
112,Thinks the difference between the numerator and denominator determines how close the fraction is to 1,Understanding of fraction proximity to whole numbers based on numerator-denominator relationship,Fractions,7/8,3/5,Which fraction is closest to 1?,Thinks the difference between the numerator and denominator determines how close the fraction is to 1
115,Believes fraction to decimal conversion is done by writing the numerator as a decimal,Converting fractions to decimals,Arithmetic,0.75,3.04,What is the decimal equivalent of the fraction \( \frac{3}{4} \)?,Believes fraction to decimal conversion is done by writing the numerator as a decimal
116,Believes an outlier is determined by the number of decimal places a number has,Understanding Outliers in Data Analysis,Statistics,123.456 (This is not actually an outlier based on decimal places),"123.45, 123.456789, 123 (These are wrong because they assume that the number of decimal places determines if a number is an outlier)",Which of the following numbers is considered an outlier based on the number of decimal places it has?,Believes an outlier is determined by the number of decimal places a number has
121,Believes midpoint in grouped frequency table is found by multiplying midpoint by frequency,Understanding how to calculate contributions from class intervals in grouped frequency tables.,Statistics,Multiply the midpoint (15) by the frequency (4) and then divide by the number of class intervals.,Multiply the midpoint (15) by the frequency (4) directly to get the contribution.,"In a grouped frequency table, if the midpoint of a class interval is 15 and the frequency is 4, what is the correct way to find the contribution of this class interval to the total?",Believes midpoint in grouped frequency table is found by multiplying midpoint by frequency.
122,Thinks they can convert percentages to fractions by writing the percentage value as both the numerator and the denominator,Conversion of percentages to fractions,Fractions and Percentages,1/2,50/50,What is the fraction equivalent of 50% if you incorrectly apply the rule of writing the percentage value as both the numerator and the denominator?,Thinks they can convert percentages to fractions by writing the percentage value as both the numerator and the denominator
124,Believes perpendicular bisectors is the term used to describe two lines that are parallel,"Understanding the definitions of perpendicular lines, perpendicular bisectors, and parallel lines.",Geometry,"Two lines are perpendicular if they intersect at a 90-degree angle, and a perpendicular bisector is a line that divides another line segment into two equal parts at 90 degrees.",Two lines are considered perpendicular bisectors if they run alongside each other without ever meeting.,Which of the following statements correctly describes the relationship between two lines in a plane?,Believes perpendicular bisectors is the term used to describe two lines that are parallel.
125,Thinks the division sign means to add,Understanding Division in Proportions,Ratio and Proportions,1 cup,6 cups,"If a recipe calls for 4 cups of flour to make 8 servings, how many cups of flour are needed for 2 servings?",Thinks the division sign means to add
128,Does not understand how to read both x and y coordinates,Reading Coordinates on the Cartesian Plane,Coordinate Geometry,"(3, 2)","(3, 0), (0, 2)",What are the coordinates of point P on the coordinate plane if P is located 3 units to the right of the origin and 2 units above the origin?,Does not understand how to read both x and y coordinates
129,Believes they can change only one side of a ratio and it will remain equivalent,Understanding Equivalent Ratios,Ratios and Proportions,16,9,"If the ratio of boys to girls in a classroom is 3:4, and there are 12 boys, how many girls are there?",Believes they can change only one side of a ratio and it will remain equivalent
135,Thinks the value of an exterior angle is 360 degrees,Exterior Angles of Polygons,Geometry,45 degrees,360 degrees,What is the measure of each exterior angle of a regular octagon?,Thinks the value of an exterior angle is 360 degrees
137,Does not know the meaning of the word identity ,Understanding function equivalence.,Functions.,Two functions are identical if they have the same domain and produce the same output for every input.,Two functions are identical if they look similar when graphed.,What does it mean for two functions to be identical?,Does not know the meaning of the word identity.
139,Thinks triple means add three,Multiplication by Three,Arithmetic Operations,6 cups,5 cups,"If a recipe calls for triple the amount of sugar and the original recipe uses 2 cups, how much sugar should you use?",Thinks triple means add three
140,Believes cumulative frequency is plotted at the lower bound of the class,Understanding Cumulative Frequency in Grouped Data,Statistics,The total number of students surveyed is 45.,There are 45 students who studied exactly 10 hours.,"A grouped frequency table shows the number of hours students spent studying per week. If the last interval is ""10 or more hours"" and the cumulative frequency at this point is 45, which of the following statements is true based on the student's understanding that cumulative frequency is plotted at the lower bound of the class?",Believes cumulative frequency is plotted at the lower bound of the class.
144,Mixes up the x and y values of the coordinates,Symmetry in Coordinate Plane,Coordinate Geometry,"(-3, -4)","(3, 4)","If the coordinates of point P are (3, -4), what are the coordinates of point Q which is symmetrical to point P with respect to the y-axis?",Mixes up the x and y values of the coordinates
145,Does not know how to convert percentages with a decimal point into decimals,Converting Percentages to Decimals,Arithmetic,20.0,2.0,What is 40% of 50 expressed as a decimal?,Does not know how to convert percentages with a decimal point into decimals
147,Multiplies instead of dividing when distributing a total amount,Division as equal sharing,Arithmetic,8,288,A teacher has 48 books and wants to distribute them equally among her 6 students. How many books will each student receive?,Multiplies instead of dividing when distributing a total amount
148,Confuses theoretical and experimental probability,Differentiating between theoretical and experimental probability,Probability,1/2,45/100,A coin is flipped 100 times and lands on heads 45 times. What is the theoretical probability of the coin landing on heads?,Confuses theoretical and experimental probability
149,Believes P(success) in probability notation means the number of successes,Understanding probability as a ratio of favorable outcomes to total outcomes,Probability,5/8,5,"A bag contains 5 red marbles and 3 green marbles. If a marble is randomly selected from the bag, what is the probability (P) of selecting a red marble?",Believes P(success) in probability notation means the number of successes
150,Confuses written 'teen' numbers with their corresponding single-digit number,Understanding place value in two-digit numbers,Addition,Twenty,Twenty-one,What is the sum of seven and thirteen?,Confuses written 'teen' numbers with their corresponding single-digit number
153,"When dividing decimals with the same number of decimal places as each other, assumes the answer also has the same number of decimal places",Decimal Division Understanding,Arithmetic Operations,3,0.3,"If you divide 0.45 by 0.15, what is the result?","When dividing decimals with the same number of decimal places as each other, assumes the answer also has the same number of decimal places"
155,Forgets to apply inverse trigonometric function when finding an angle,Application of Inverse Tangent Function to Find Angles in Right Triangles,Trigonometry,Approximately 36.87 degrees,Approximately 0.64 radians,"In a right triangle, if the length of the opposite side is 3 units and the adjacent side is 4 units, what is the measure of the angle θ between the adjacent side and the hypotenuse?",Forgets to apply inverse trigonometric function when finding an angle
156,Confuses the graph of a linear equation with a quadratic equation,Graphing Linear Equations vs Quadratic Equations,Algebra,A straight line on a Cartesian plane.,A parabolic curve on a Cartesian plane.,Which of the following graphs represents a linear equation?,Confuses the graph of a linear equation with a quadratic equation
157,Believes squared units can be used to measure lengths,Understanding of square roots and units in measurement.,Geometry.,4 meters.,16 meters.,"If a square has an area of 16 square meters, what is the length of one side?",Believes squared units can be used to measure lengths.
160,Believes that adding a positive to a negative makes your answer more negative,Addition of Integers,Basic Arithmetic,-5,-19,What is the result of adding -12 and +7?,Believes that adding a positive to a negative makes your answer more negative.
163,Thinks only one variable can introduce bias,Understanding Multivariate Analysis in Experimental Design,Statistics,The results may be biased due to ignoring other significant variables.,The results will be completely accurate since only one variable is considered.,"In a study comparing the heights of plants from two different species, if a student only considers the species as a variable but ignores the soil type and sunlight exposure, which of the following is true?",Thinks only one variable can introduce bias
