MisconceptionId,MisconceptionName,ConstructName,SubjectName,AnswerAText,AnswerBText,QuestionText,MisconceptionB
2506,"Believes cumulative frequency is the sum of each class with the previous class, rather than all previous classes",Understanding Cumulative Frequency Calculation,Statistics,5,35,"A frequency table shows the number of students who read books each week. If the cumulative frequency for reading 3 books is 15, and for reading 4 books is 20, how many students read exactly 4 books this week?","Believes cumulative frequency is the sum of each class with the previous class, rather than all previous classes"
2509,Mixes up the sets in a Venn diagram,Understanding intersections and unions in sets,Sets and Venn Diagrams,70,90,"In a survey of 100 students, 60 said they like Math, 50 said they like Science, and 20 said they like both Math and Science. How many students like only one subject?",Mixes up the sets in a Venn diagram
2513,"When finding the nth term rule for a quadratic sequence, believes that the coefficient of n squared is determined by first differences",Understanding the nth term rule for quadratic sequences,Sequences and Series,2,4,"Consider the quadratic sequence: 3, 7, 13, 21, 31. What is the coefficient of \(n^2\) in the nth term rule for this sequence?",Believes that the coefficient of \(n^2\) is determined by first differences.
2518,May have made a calculation error using the order of operations,Order of Operations (PEMDAS/BODMAS),Arithmetic Operations,31,45,Calculate \(5 + 12 \times 3 - 6\).,May have made a calculation error using the order of operations.
2521,Does not know how to measure reflex angles,Understanding and measuring reflex angles,Geometry,315 degrees,135 degrees,What is the measure of a reflex angle that is supplementary to a 45-degree angle?,Does not know how to measure reflex angles
2522,Believes the total of the circle in a Venn should be included when intersections should be omitted,Understanding of Venn Diagrams and Overlapping Sets,Probability and Statistics,10,30,"In a survey of 100 students, 60 students like Math, 50 students like Science, and 20 students like both Math and Science. How many students do not like either Math or Science?",Believes the total of the circle in a Venn should be included when intersections should be omitted
2523,Has added on the power of 1/4 rather than raise to the power of 1/4,Understanding of fractional exponents as roots,Exponents and Roots,2,5,What is the simplified form of \( (16)^{\frac{1}{4}} \)?,Has added on the power of 1/4 rather than raise to the power of 1/4
2527,"Writes a repeated root once, rather than in a squared bracket",Understanding of polynomial roots and multiplicity,Algebra,"3 (repeated), -2","3, -2",Find the roots of the polynomial \( f(x) = (x-3)^2(x+2) \).,"Writes a repeated root once, rather than in a squared bracket"
2528,Thinks that the perimeter on a square grid is the number of squares surrounding the rectangle,Perimeter Calculation on a Grid,Geometry,8 units,6 units,"What is the perimeter of a rectangle formed by connecting four points on a square grid, where each side of the square grid is 1 unit long?",Thinks that the perimeter on a square grid is the number of squares surrounding the rectangle
2529,Does not think a ton is a unit of mass,Understanding and converting between metric and imperial units of mass,Conversion of Units,1.5 tons,3000 kilograms,What is the weight of a small car in tons?,Does not think a ton is a unit of mass
2533,Does not realise that two letters together are multiplying,Combining like terms in algebraic expressions,Algebra,x + 4y,2xy + 3y - xy + y,Simplify the expression: 2x + 3y - x + y.,Does not realise that two letters together are multiplying.
2534,When converting between non standard form and standard form assumes changes to the base will not affect the power,Understanding that changing the base of an exponential expression requires adjusting the exponent accordingly.,Exponents and Logarithms,2,4,Convert \(3^4\) to a power with base 9. What is the exponent?,When converting between non-standard form and standard form assumes changes to the base will not affect the power
2536,Misunderstands the capture-recapture method,Understanding the capture-recapture method for estimating population size,Statistics,400,180,"A wildlife biologist wants to estimate the number of fish in a lake using the capture-recapture method. On the first day, she catches 100 fish, marks them, and releases them back into the lake. The next day, she catches 80 fish, of which 20 are marked. Assuming no migration or mortality, what is the estimated total number of fish in the lake?",Misunderstands that the ratio of marked fish in the second catch represents the proportion of the total population that was initially marked.
2538,Confuses the value of the variable with cumulative frequency,Understanding Probability Calculation,Probability and Statistics,15/50 or simplified form 3/10,15,"In a survey of 50 students, 20 said they prefer apples, 15 said they prefer bananas, and the rest said they prefer oranges. If one student is chosen at random, what is the probability that the student prefers oranges?",Confuses the value of the variable with cumulative frequency
2540,Confuses maximum and minimum,Optimization of area under constraint,Calculus,625 square meters,2500 square meters,A farmer wants to build a rectangular fence for his sheep using 100 meters of fencing material. What is the maximum area he can enclose with this material?,Confuses maximum and minimum
2541,"When finding the square root of a decimal, believes the answer should have the same number of decimal places",Understanding the relationship between decimals and their square roots.,Arithmetic,0.4,0.16,What is the square root of 0.16?,"When finding the square root of a decimal, believes the answer should have the same number of decimal places."
2545,Does not know that prime numbers have exactly two factors,Understanding Prime Numbers and Their Factors,Number Theory,11,"4, 9, 15",Which of the following numbers has exactly two factors?,Does not know that prime numbers have exactly two factors
2548,Does not increase the denominator when an item is added in a probability question,Calculating conditional probabilities without replacement,Probability,2/15,1/3,"A bag contains 4 red marbles and 6 blue marbles. If one marble is drawn and then another without replacement, what is the probability that both marbles are red?",Does not increase the denominator when an item is added in a probability question
2552,"When adding decimals, thinks the answer has to have the same number of decimals as the total in the question",Decimal Addition and Understanding Decimal Places,Arithmetic,2,3,"If you add 0.45 and 0.3, how many decimal places will the correct sum have?","When adding decimals, thinks the answer has to have the same number of decimals as the total in the question"
2553,Gives the second significant figure when asked for the first,Rounding Numbers to the Nearest Whole Number,Arithmetic,44,43.7,Round the number 43.678 to the nearest whole number.,Gives the second significant figure when asked for the first
2556,Thinks the subtraction sign means multiply,Understanding Subtraction vs Multiplication,Arithmetic Operations,3,10,"If \( 5 - 2 \) is interpreted as multiplication due to a misconception, what would be the result?",Thinks the subtraction sign means multiply
2557,Mixes up cubing and squaring,Distinguishing between squaring and cubing,Exponents,27,9,What is the result of 3 cubed (3^3)?,Mixes up cubing and squaring
2558,"When writing fraction from diagram, writes total as denominator",Writing fractions from visual models,Fractions,5/12,12/5,"A rectangle is divided into 12 equal parts. If 5 parts are shaded, which of the following represents the fraction of the rectangle that is shaded?","When writing a fraction from a diagram, students might write the total number of parts as the numerator instead of the denominator."
2559,When dividing numbers with different bases subtracts the powers but divides the base numbers.,Dividing Exponents with Different Bases Correctly,Exponents and Powers,2,4,What is the result of \(\frac{2^5}{4^2}\)?,"When dividing numbers with different bases, subtracts the powers but divides the base numbers."
2560,Confuses the formulas for the perimeter of a sector and the area of a sector ,Area of a Sector,Geometry,6π cm²,2π cm,A circular sector has a radius of 6 cm and a central angle of 60 degrees. What is the area of this sector?,Confuses the formulas for the perimeter of a sector and the area of a sector
2562,Confuses the lower and upper bound,Understanding and applying interval notation for inequalities,Algebra,"(3, 5]","[5, 3)",Find the interval notation for the solution of the inequality \(3 < x \leq 5\).,Confuses the lower and upper bound
2563,Believes to complete a part whole model you select a value already given in the model,Understanding of Completing Part-Whole Models,Fractions and Part-Whole Relationships,80 (the correct calculation would involve subtracting 40 from 120),"120, 40 (these values are already given in the model)","In a part-whole model where the whole is represented by 120 apples and one part is represented by 40 oranges, if a student believes they must choose a value already given in the model to find the other part, what value might they incorrectly select as the missing part?",Believes to complete a part whole model you select a value already given in the model
2564,Gives the intersect value of a Venn diagram when asked to find the value of a set only,Understanding of the principle of inclusion-exclusion in set operations.,Set Theory,10,0,"In a class of 50 students, 30 students play basketball, 20 students play soccer, and 10 students play both basketball and soccer. How many students do not play either basketball or soccer?",Assumes that the number of students who play both sports is part of the total count for those who play only one sport.
2567,Believes they only need to multiply the first pair of terms when expanding a double bracket.,Expanding Double Brackets,Algebra,2x^2 - 5x - 12,2x - 12,Expand the expression (2x + 3)(x - 4).,Believes they only need to multiply the first pair of terms when expanding a double bracket.
2568,Believes all the multiples of a number will also be multiples of its multiples,Least Common Multiple (LCM),Number Theory,"18, 36, 54","12, 24, 48",Which of the following numbers is a multiple of both 6 and 9?,Believes all the multiples of a number will also be multiples of its multiples
2570,Confuses interior angles with exterior angles,Understanding of interior angles in polygons,Geometry,108 degrees,72 degrees,What is the measure of one interior angle of a regular pentagon?,Confuses interior angles with exterior angles
2571,"When dividing numbers with different bases, divides the powers and divides the base numbers.",Dividing Exponential Expressions with Different Bases,Exponents and Fractions,\( \frac{8}{9} \),\( \frac{1}{6} \),What is the result of \( \frac{2^3}{3^2} \)?,"When dividing numbers with different bases, divides the powers and divides the base numbers."
2574,Believes that when multiplying by a power of 10 you add zeroes after the decimal point,Multiplication by powers of ten,Arithmetic,350,3.500,What is the result of multiplying 3.5 by 10^2?,Believes that when multiplying by a power of 10 you add zeroes after the decimal point
2575,Thinks adding same amount to each side of a ratio gives an equivalent ratio,Understanding Equivalent Ratios,Ratios and Proportions,7:6,3:2,"If the ratio of boys to girls in a class is 3:2 and we add 4 more boys and 4 more girls to the class, what will the new ratio be?",Thinks adding the same amount to each side of a ratio gives an equivalent ratio.
2578,"Mixes up sides of a ratio, when working with vectors for line segments.",Ratio application in line segments division.,Geometry,30 units.,20 units.,"A line segment AB is divided into two parts in the ratio 3:2. If the length of the entire segment AB is 50 units, what is the length of the longer part of the segment?","Mixes up sides of a ratio, when working with vectors for line segments."
2580,Believes degrees can be used to measure length,Understanding of units for measuring length and area,Geometry,6 units,36 degrees,What is the length of the side of a square if its area is 36 square units?,Believes degrees can be used to measure length
2582,"When multiplying numbers with the same base, multiplies the powers ",Multiplying Exponents with the Same Base,Exponents,\(5^7\),\(25^{12}\),Simplify the expression \(5^3 \times 5^4\).,"When multiplying numbers with the same base, multiplies the powers."
2584,Believes that any percentage of a larger number will be greater than any percentage of a smaller number,Understanding Relative Magnitude of Percentages.,Percentages and Comparison.,"40% of Company Z's revenue being $9,000.","25% of Company Y's revenue being $12,000.","If 25% of Company X's revenue is $10,000, which is more: 25% of Company Y's revenue being $12,000 or 40% of Company Z's revenue being $9,000?",Believes that any percentage of a larger number will be greater than any percentage of a smaller number.
5,"When measuring a reflex angle, gives the acute or obtuse angle that sums to 360 instead",Reflex Angle Measurement,Geometry,225°,"135°, 45°",What is the measure of the reflex angle at point B in the following polygon if the interior angle at point B measures 135°?,"When measuring a reflex angle, gives the acute or obtuse angle that sums to 360 instead."
7,Believes gradient = change in y,Gradient Calculation Using Change in Y Only,Coordinate Geometry,2,8,"A student believes that the gradient of a line is simply the change in y. Given two points on a line, (3, 5) and (7, 13), what does this student incorrectly calculate as the gradient?",Believes gradient = change in y
10,"Believes duration can be read from a timetable, rather than calculating from start and end times","Understanding that duration is calculated from start to end times, not read directly from timetables.",Time and Duration Calculations.,3 hours and 30 minutes.,3 hours.,"A train departs from Station A at 10:30 AM and arrives at Station B at 2:00 PM on the same day. According to the timetable, how long is the train journey?","Believes duration can be read from a timetable, rather than calculating from start and end times."
12,Thinks that the side view does not include the furthest rows back,Understanding 3D shapes' projections and views.,Geometry.,1 square.,25 squares.,"A cube has a side length of 5 cm. When looking at its side view, how many squares can you see if you consider only the outer layer?",Thinks that the side view does not include the furthest rows back.
13,"Does not subtract from the hours, when having to borrow for a time calculation",Borrowing in time calculations,Time Calculation,6:02 PM,5:62 PM,"If it's currently 4:27 PM and a train departs in 1 hour and 35 minutes, what time will the train depart? Do not forget to adjust the minutes if they exceed 60.","Does not subtract from the hours, when having to borrow for a time calculation"
17,Confuses AM and PM when calculating time,Understanding and Applying the 12-Hour Clock System,Time Calculation,3:00 PM,2:00 AM,"If a train departs at 10:30 AM and travels for 4 hours and 30 minutes, what time does it arrive?",Confuses AM and PM when calculating time
18,"Given the length of the sides, still does not recognise there is enough information to find the area",Understanding the formula for finding the area of a rectangle (length x width),Geometry,40 square centimeters,13 square centimeters,"If a rectangle has sides of lengths 8 cm and 5 cm, what is the area of the rectangle?",Assuming that the area can only be found if the shape is a square or by adding the lengths of the sides.
20,Believes the number of wholes in a mixed number multiplies by the fraction part,Adding Mixed Numbers Correctly,Arithmetic Operations with Mixed Numbers,\(4\frac{1}{4}\),\(3\frac{9}{8}\),What is the result when you add \(2\frac{3}{4}\) and \(1\frac{1}{2}\)?,Believes the number of wholes in a mixed number multiplies by the fraction part
25,Does not realise that when you multiply by 0 the answer will always be 0,Multiplication by Zero,Arithmetic,0,5,What is the result of 5 x 0?,Does not realise that when you multiply by 0 the answer will always be 0
27,Believes squaring a fraction requires you to double both parts,Squaring Fractions Correctly,Arithmetic Operations on Fractions,\( \frac{9}{16} \),\( \frac{6}{8} \),"If you have the fraction \( \frac{3}{4} \), what is the result of squaring this fraction?",Believes squaring a fraction requires you to double both parts
30,"When asked for a number n times smaller or bigger, subtracts or adds n",Understanding scale factors in dimensions,Geometry,20 units,9 units,"If the length of a rectangle is 5 times larger than its width, and the width is 4 units, what is the length of the rectangle?","When asked for a number n times larger, adds n instead of multiplying by n."
36,Enlarges by the wrong centre of enlargement,Transformation - Enlargement with a given scale factor and center,Geometry,"(4,6)","(2,3), (5,1), (4,6)","A triangle has vertices at points A(2,3), B(5,1), and C(4,6). If this triangle is enlarged by a scale factor of 2, which of the following could be the coordinates of the new position of point A if the center of enlargement is incorrectly chosen as (0,0)?",Enlarges by the wrong centre of enlargement
39,Multiplies by 1000 instead of 100 when converting a decimal to a percentage,Decimal to Percentage Conversion,Arithmetic,85%,850%,"If a student scored 0.85 on a test, what is their score as a percentage?",Multiplies by 1000 instead of 100 when converting a decimal to a percentage
40,Believes midpoint multiplied by frequency is equivalent to frequency density,Frequency Density Calculation,Statistics,Divide the frequency by the class width.,Multiply the midpoint by the frequency.,"In a grouped frequency table, if a class interval's midpoint is 50 and its frequency is 10, what is the correct way to calculate the frequency density?",Believes midpoint multiplied by frequency is equivalent to frequency density.
41,Believes the mean is the number of categories given divided by something,Understanding the Applicability of Mean in Categorical Data Analysis,Statistics,This question does not make sense because mean cannot be applied to categorical data.,2,"A survey was conducted among 10 students about their favorite color, with 4 choosing blue, 3 choosing green, and 3 choosing red. What is the mean of the number of categories chosen by the students?",Believes the mean is the number of categories given divided by something
43,Confuses the terms edges and vertices,Understanding of vertices in polyhedra,Geometry,8,12,How many vertices does a cube have?,Confuses the terms edges and vertices
44,"When adding or subtracting surds, just adds or subtracts the numbers under the surd rather than first trying to simplifying to find like surds",Simplifying Surds,Algebra,\(4\sqrt{2}\),\(5\),Simplify the expression \(3\sqrt{2} + 2\sqrt{8} - \sqrt{18}\).,"When adding or subtracting surds, just add or subtract the numbers under the surd rather than first trying to simplifying to find like surds."
46,Does not realise that division can be broken down into factors,Understanding division as repeated subtraction or finding factors,Division and Factors,5,"12, 18, 20","If \(15\) apples are to be divided equally among children, and each child gets \(3\) apples, how many children are there?",Does not realise that division can be broken down into factors
49,Doesn't believe that when you divide by 0 the answer will always be 0,Division by Zero Concept,Arithmetic,Undefined or error,0,What is the result of dividing 10 by 0?,Doesn't believe that when you divide by 0 the answer will always be 0
50,"When given a non-unit fraction of an amount and asked to find the total, answers as if it had been the unit fraction",Finding the whole from a part of a fraction,Fractions,16,9,"If 3/4 of a number is 12, what is the whole number?","When given a non-unit fraction of an amount and asked to find the total, answers as if it had been the unit fraction (in this case, assuming that 1/4 of the number is 12 instead of 3/4)."
56,Assumes a negative number is not rational,Rational Numbers,Number Theory,-2/3,√2,Which of the following numbers is rational?,Assumes a negative number is not rational
59,Cannot identify a common factor when simplifying algebraic fractions,Identifying common factors in algebraic expressions,Algebra,\(\frac{x}{2}\),\(\frac{6x^2 + 9x}{12x + 18}\),Simplify the fraction \(\frac{6x^2 + 9x}{12x + 18}\).,Cannot identify a common factor when simplifying algebraic fractions
62,Does not realise that a curved line represents a changing gradient,Understanding of derivative as a rate of change,Calculus,The slope of the tangent line is increasing.,The slope of the tangent line is constant.,"A student is looking at the graph of a function where the curve is concave up. They must determine if the slope of the tangent line at any point on this curve is constant, increasing, or decreasing.",Does not realize that a curved line represents a changing gradient.
63,Believes 'data' and 'sample' are interchangeable,Differentiating between sample and data in statistical studies,Statistics,Sample,Data,"In a study about student reading habits, a researcher collected information from 50 randomly selected students out of a school of 1000 students. Which term correctly describes the 50 students in this context?",Believes 'data' and 'sample' are interchangeable
65,Cannot spot a variable within a written scenario,Identifying variables in word problems.,Algebra,The number of cupcakes Maria bought.,The price of one cupcake.,"A local bakery sells cupcakes for $2 each. If Maria spent $12 on cupcakes, how many cupcakes did she buy? Which part of this problem represents a variable?",Cannot spot a variable within a written scenario.
67,Divides by 1000 instead of 100 when converting a decimal to a percentage,Converting decimals to percentages,Arithmetic,35%,35000%,"If a student scored 0.35 on a test, what is their score as a percentage?",Divides by 1000 instead of 100 when converting a decimal to a percentage
69,"When given a non-unit fraction of an amount, treats it like a unit fraction",Understanding the relationship between non-unit fractions and their unit fraction counterparts,Fractions,6,12,"If \( \frac{3}{4} \) of a number is 18, what is \( \frac{1}{4} \) of that number?","When given a non-unit fraction of an amount, treats it like a unit fraction"
73,Confuses a function with an expression,Distinguishing between functions and expressions.,Algebra,This is an expression that can be evaluated for specific values of \(x\).,This is a function that maps inputs to outputs.,Consider the algebraic expression \(2x^2 + 3x - 5\). Which of the following statements correctly describes this expression?,Confuses a function with an expression.
75,Believes that the directions of positive and negative vectors are the opposite way around.,Vector Direction and Addition Principles,Vector Arithmetic,East,West,"Consider two vectors, A with a magnitude of 5 units pointing east, and B with a magnitude of 3 units pointing west. If vector C is the result of adding A and B, which direction does vector C point?",Believes that the directions of positive and negative vectors are the opposite way around.
79,Does not understand how to divide algebraic terms,Dividing coefficients and subtracting exponents when dividing algebraic terms.,Algebra - Division of Polynomials,\( 3x^2 \),\( 3x^4 \),Simplify the expression \( \frac{12x^3}{4x} \).,Does not understand how to divide algebraic terms.
87,Does not know what an exterior angle is ,Understanding of exterior angles in a triangle.,Geometry.,110 degrees.,10 degrees.,What is the measure of an exterior angle of a triangle if one of its interior angles is 60 degrees and the other adjacent interior angle is 50 degrees?,Does not know what an exterior angle is.
90,Does not understand place value after the decimal point,Understanding Tenths Place Value,Decimal Place Value,0.5,"50, 5, 500",What is the value of the digit 5 in the number 34.56?,Does not understand place value after the decimal point
92,"When identifying the center of rotation, writes down the origin",Identifying the Center of Rotation for Geometric Transformations,Geometry,A point that is equidistant from corresponding vertices of the original triangle and its image.,"The origin (0,0) on the coordinate plane.",A triangle has been rotated around a point to create its image. The original triangle and its image do not overlap. Which of the following could be the center of rotation?,"When identifying the center of rotation, writes down the origin regardless of the position of the shapes."
93,"When multiplying a surd of the form a✓b by an integer, believes the integer and the number under the surd are multiplied",Multiplying integers with surds without distributing the multiplication into the radicand.,Algebra - Surds and Radicals,\(3\sqrt{5}\),\(\sqrt{15}\),What is the result of \(3 \times \sqrt{5}\)?,"When multiplying a surd of the form \(a\sqrt{b}\) by an integer, believes the integer and the number under the surd are multiplied."
94,"When solving simultaneous equations, thinks they can add variables to one of the equations to make terms across the 2 equations identical",Solving systems of linear equations by elimination,Algebra  ,"x = 3, y = 2  ","x = 4, y = 1  ",Solve the system of equations below by eliminating y.  ,"When solving simultaneous equations, thinks they can add variables to one of the equations to make terms across the 2 equations identical  "
